{
  "$schema": "https://json-schema.org/draft/2020-12/schema",
  "$id": "https://github.com/heimgewebe/vibe-lab/schemas/experiment.registration.v2.schema.json",
  "title": "Vibe-Lab Prospective Experiment Registration v2",
  "type": "object",
  "additionalProperties": false,
  "required": [
    "schema_version",
    "experiment_id",
    "consumer",
    "decision_target",
    "intervention",
    "control_condition",
    "treatment_condition",
    "measurement",
    "comparison",
    "evidence_sources",
    "review_at",
    "expires_at",
    "closure",
    "surface_budget",
    "boundary"
  ],
  "properties": {
    "schema_version": {
      "const": "experiment.registration.v2"
    },
    "experiment_id": {
      "type": "string",
      "pattern": "^[0-9]{4}-[0-9]{2}-[0-9]{2}_[a-z0-9][a-z0-9-]*$"
    },
    "consumer": {
      "type": "object",
      "additionalProperties": false,
      "required": [
        "organ",
        "use",
        "relation",
        "status",
        "evidence_ref"
      ],
      "properties": {
        "organ": {
          "type": "string",
          "minLength": 1
        },
        "use": {
          "type": "string",
          "minLength": 10
        },
        "relation": {
          "const": "external"
        },
        "status": {
          "const": "current"
        },
        "evidence_ref": {
          "type": "string",
          "minLength": 3,
          "pattern": "^(bureau-task|github|decision|contract):\\S+$"
        }
      }
    },
    "decision_target": {
      "type": "object",
      "additionalProperties": false,
      "required": [
        "question",
        "owner"
      ],
      "properties": {
        "question": {
          "type": "string",
          "minLength": 10
        },
        "owner": {
          "type": "string",
          "minLength": 1
        }
      }
    },
    "intervention": {
      "type": "object",
      "additionalProperties": false,
      "required": [
        "name",
        "description"
      ],
      "properties": {
        "name": {
          "type": "string",
          "minLength": 1
        },
        "description": {
          "type": "string",
          "minLength": 10
        }
      }
    },
    "control_condition": {
      "$ref": "#/$defs/condition"
    },
    "treatment_condition": {
      "$ref": "#/$defs/condition"
    },
    "measurement": {
      "type": "object",
      "additionalProperties": false,
      "required": [
        "primary_metric",
        "direction",
        "unit",
        "minimum_material_effect",
        "cost_metric",
        "method",
        "success",
        "falsification"
      ],
      "properties": {
        "primary_metric": {
          "type": "string",
          "pattern": "^[a-z0-9][a-z0-9_.-]*$"
        },
        "direction": {
          "enum": [
            "higher_is_better",
            "lower_is_better"
          ]
        },
        "unit": {
          "type": "string",
          "pattern": "^[a-z0-9][a-z0-9_.%/-]*$"
        },
        "minimum_material_effect": {
          "type": "number",
          "minimum": 0
        },
        "method": {
          "type": "string",
          "minLength": 10
        },
        "success": {
          "type": "string",
          "minLength": 5
        },
        "falsification": {
          "type": "string",
          "minLength": 5
        },
        "scorecard": {
          "type": "object",
          "additionalProperties": false,
          "required": [
            "schema_version",
            "components"
          ],
          "properties": {
            "schema_version": {
              "const": "additive-binary-scorecard.v1"
            },
            "components": {
              "type": "array",
              "minItems": 1,
              "uniqueItems": true,
              "items": {
                "type": "object",
                "additionalProperties": false,
                "required": [
                  "id",
                  "weight",
                  "criterion"
                ],
                "properties": {
                  "id": {
                    "type": "string",
                    "pattern": "^[a-z][a-z0-9_]*$"
                  },
                  "weight": {
                    "type": "number",
                    "exclusiveMinimum": 0
                  },
                  "criterion": {
                    "type": "string",
                    "minLength": 10
                  },
                  "fatal_when_zero": {
                    "type": "boolean"
                  }
                }
              }
            }
          }
        },
        "cost_metric": {
          "type": "object",
          "additionalProperties": false,
          "required": [
            "id",
            "unit",
            "method"
          ],
          "properties": {
            "id": {
              "type": "string",
              "pattern": "^[a-z0-9][a-z0-9_.-]*$"
            },
            "unit": {
              "const": "seconds"
            },
            "method": {
              "type": "string",
              "minLength": 10
            }
          }
        }
      }
    },
    "comparison": {
      "type": "object",
      "additionalProperties": false,
      "required": [
        "mode",
        "unit",
        "minimum_control",
        "minimum_treatment",
        "comparability_constraints",
        "confounders"
      ],
      "properties": {
        "mode": {
          "enum": [
            "paired",
            "unpaired"
          ]
        },
        "unit": {
          "type": "string",
          "minLength": 3
        },
        "minimum_control": {
          "type": "integer",
          "minimum": 3
        },
        "minimum_treatment": {
          "type": "integer",
          "minimum": 3
        },
        "comparability_constraints": {
          "type": "array",
          "minItems": 1,
          "items": {
            "type": "string",
            "minLength": 3
          }
        },
        "confounders": {
          "type": "array",
          "items": {
            "type": "string",
            "minLength": 3
          }
        }
      }
    },
    "evidence_sources": {
      "type": "object",
      "additionalProperties": false,
      "required": [
        "allowed",
        "independent_observation_required"
      ],
      "properties": {
        "allowed": {
          "type": "array",
          "minItems": 1,
          "uniqueItems": true,
          "items": {
            "type": "string",
            "minLength": 3
          }
        },
        "independent_observation_required": {
          "const": true
        }
      }
    },
    "review_at": {
      "type": "string",
      "format": "date-time"
    },
    "expires_at": {
      "type": "string",
      "format": "date-time"
    },
    "closure": {
      "type": "object",
      "additionalProperties": false,
      "required": [
        "allowed_outcomes",
        "archive_path"
      ],
      "properties": {
        "allowed_outcomes": {
          "type": "array",
          "minItems": 5,
          "uniqueItems": true,
          "items": {
            "enum": [
              "promote",
              "pilot",
              "defer",
              "reject",
              "archive"
            ]
          },
          "maxItems": 5,
          "allOf": [
            {
              "contains": {
                "const": "promote"
              }
            },
            {
              "contains": {
                "const": "pilot"
              }
            },
            {
              "contains": {
                "const": "defer"
              }
            },
            {
              "contains": {
                "const": "reject"
              }
            },
            {
              "contains": {
                "const": "archive"
              }
            }
          ]
        },
        "archive_path": {
          "type": "string",
          "pattern": "^experiments/_archive/[^/]+$"
        }
      }
    },
    "boundary": {
      "type": "object",
      "additionalProperties": false,
      "required": [
        "experiment_only",
        "no_auto_policy",
        "no_auto_routing",
        "no_queue_authority",
        "no_runtime_authority"
      ],
      "properties": {
        "experiment_only": {
          "const": true
        },
        "no_auto_policy": {
          "const": true
        },
        "no_auto_routing": {
          "const": true
        },
        "no_queue_authority": {
          "const": true
        },
        "no_runtime_authority": {
          "const": true
        }
      }
    },
    "surface_budget": {
      "type": "object",
      "additionalProperties": false,
      "required": [
        "durable_units_added",
        "durable_units_removed_or_replaced",
        "balance"
      ],
      "properties": {
        "durable_units_added": {
          "type": "array",
          "uniqueItems": true,
          "items": {
            "type": "string",
            "minLength": 3
          }
        },
        "durable_units_removed_or_replaced": {
          "type": "array",
          "uniqueItems": true,
          "items": {
            "type": "string",
            "minLength": 3
          }
        },
        "balance": {
          "enum": [
            "non_positive",
            "reviewed_exception"
          ]
        },
        "exception": {
          "type": "object",
          "additionalProperties": false,
          "required": [
            "status",
            "reviewer",
            "reviewed_at",
            "rationale",
            "evidence_ref"
          ],
          "properties": {
            "status": {
              "const": "reviewed"
            },
            "reviewer": {
              "type": "string",
              "minLength": 1
            },
            "reviewed_at": {
              "type": "string",
              "format": "date-time"
            },
            "rationale": {
              "type": "string",
              "minLength": 20
            },
            "evidence_ref": {
              "type": "string",
              "minLength": 3,
              "pattern": "^(bureau-task|github|decision|contract):\\S+$"
            }
          }
        }
      },
      "allOf": [
        {
          "if": {
            "properties": {
              "balance": {
                "const": "non_positive"
              }
            },
            "required": [
              "balance"
            ]
          },
          "then": {
            "not": {
              "required": [
                "exception"
              ]
            }
          }
        },
        {
          "if": {
            "properties": {
              "balance": {
                "const": "reviewed_exception"
              }
            },
            "required": [
              "balance"
            ]
          },
          "then": {
            "required": [
              "exception"
            ]
          }
        }
      ]
    }
  },
  "$defs": {
    "condition": {
      "type": "object",
      "additionalProperties": false,
      "required": [
        "id",
        "description"
      ],
      "properties": {
        "id": {
          "type": "string",
          "pattern": "^[a-z0-9][a-z0-9_-]*$"
        },
        "description": {
          "type": "string",
          "minLength": 10
        }
      }
    }
  }
}
